{
  "id": "darkBotanical",
  "label": "Dark Botanical",
  "description": "Moody midnight palette, tightly clustered hero foliage, dimensional depth.",
  "categories": ["botanical"],
  "layouts": ["bouquet", "sCurve"],
  "hierarchyPreset": "heroFocus",
  "density": 0.55,
  "negativeSpace": 0.1,
  "overlapMode": "natural",
  "overlapAmount": 0.2,
  "flowProfile": "directional",
  "rhythmProfile": "organic",
  "clusterStyle": "tight",
  "clusterDensity": 0.55,
  "motifComplexity": "intricate",
  "botanicalGrowthPreset": "fern",
  "colorStrategy": "highContrast",
  "paletteIds": ["midnight-botanical"],
  "backgroundStrategy": "darkMoody",
  "svgDepthMode": "dimensional",
  "exportRecommendation": { "tileSize": 1600, "patternScale": 1, "recommendedSites": ["adobestock", "creativemarket"] }
}
